number,easychair,date,authors,title,advertisement,abstract,location
303,817,3/13/2020,Derek Runberg,CANCELLED <strike>Taking Weather Science Back Outdoors Using the micro:bit</strike>,"<p>Take weather science out of the classroom and allow students to participate in authentic, hands-on field studies on their school grounds! This workshop will be an expedition through classroom experiments that teachers can do with their students using the micro:bit and the SparkFun micro:climate kit to collect and analyze data. No prior experience necessary. Please bring a laptop or Chromebook with a USB port.</p>","<p>This workshop will be an expedition through classroom experiments that teachers can do with their students using the micro:bit and the SparkFun micro:climate kit to take weather science off the slide deck and out of the classroom to an authentic, hands-on field study on their own playground. These tools allow students to build their own instrumentation for participating in citizen science. When combined with activities designed to further student understanding, educators are able to equip students with the skills to develop questions and collect data to answer that question. Through the act of tinkering and the engineering design cycle, students will construct their own knowledge about weather and how it impacts their lives through collecting and analyzing data. Students will also develop an understanding of the atmospheric conditions around them, how to properly develop tests to receive accurate results and how to compare their results against others in their class.</p>",
304,834,3/13/2020,Shannon Duvall; Robert Duvall; Dugald Hutchings; Scott Spurlock,"Beyond the Flipped Classroom: Implementing Multiple, Simultaneous Pedagogical Styles Using Scrumage","<p>Agile methodologies claim to create effective, efficient, and happy workers by embracing a lightweight framework, autonomous teams, and rapid feedback cycles. The Scrumage (SCRUM for AGile Education) pedagogy style translates these values into the classroom. In Scrumage, students form autonomous learning cohorts and are encouraged to choose how they want to learn new material, what becomes ""homework"" versus ""classwork"", and how they spend class time. In this way, a single classroom can simultaneously facilitate game-based, flipped, and lecture-based learning. The professor becomes less of a manager and more of a learning coach. </p>
<p>This workshop will guide participants through the process of planning a course run in this unique manner, as well as give evidence for its success in courses at all levels of the curriculum. 
Laptops are optional, but participants should have access to a current course's syllabus and learning objectives to get the most out of the workshop.</p>

<p>Equipment Optional. It is not necessary for participants to bring equipment.</p>","<p>While the ""flipped classroom"" style has some educational benefits, there are also known benefits to other pedagogical approaches such as lectures, educational games, class discussions, and case studies. In addition to a wide variety of pedagogical approaches, there are a wide variety of computer science learning materials, including videos, interactive tutorials, e-textbooks and traditional textbooks. The choices of approach and materials present a series of trade-offs and may favor some groups of students over others. In this workshop, we present a methodology called Scrumage, (SCRUM for AGile Education) which allows each student in a course to adopt the pedagogical approach and materials that best fit each student's individual learning needs. Scrumage adapts concepts from the Scrum project management technique to manage student teams where the project is learning. Each team learns with the style they prefer, so that multiple pedagogical styles and materials are in use in the course simultaneously. Participants in this workshop will be introduced to the methodology, benefits, and tools of this approach and will work through guided steps to implementing it in the course of their choice.</p>",B110
305,75,3/13/2020,Leen-Kiat Soh; Markeya Peteranetz; Olga Glebova,"Adopting, Integrating, and Evaluating Computational Creativity Exercises and an Experience Report","<p>The intended audience for this workshop includes all CS educators (K-12 and post-secondary) who are interested in improving their student's learning and performance of CS concepts and computational thinking, as well as problem solving through creative thinking. The workshop and its resources will also help instructors better engage their students and serve as ideas to expand their resources to complement their teaching practices.
We will have hands-on activities working on one of the Computational Creativity exercises, and will also have an experience report on adopting the exercises at a different site not at the original site where the exercises were developed.
Participants should expert to learn about how to combine computational thinking and creative thinking; how to design meaningful and engaging exercises combining the two paradigms; be exposed to research design and the available research instruments that have been validated; how to adapt and implement the suite of Computational Creativity Exercises; and how to motivate their course design with findings regarding these exercises.
The workshop will reimburse the first 15 registered workshop participants one night of accommodation and workshop registration fee after the workshop. The workshop will also share a set of resources (Computational Creativity Exercises, Research Papers, Implementation Tips, and Research Instruments) with the participants.</p>
<p>Equipment Required. Participants must bring a laptop to equipment.</p>","<p>In this workshop, participants will learn about how to integrate computational thinking and creative thinking activities that have been shown to significantly improve student learning and performance in their classes via rigorous research investigations. In particular, participants will be familiarized with the suite of Computational Creativity Exercises (CCEs) (which are non-programming-based, group-based, active learning exercises), practice hands-on how to complete such an CCE, learn about how to integrate and adapt them into their courses, and be exposed to the educational research studies behind the development, design, and administration of these CCEs. Participants will also learn how to conduct evidence-based educational research studies. Workshop sessions will include presentations, panel-based Q&A, an experience report, breakout group discussions, and hands-on activities.</p>",B112
306,831,3/13/2020,Todd Sproull; Bill Siever,Going Native with Your Web Dev Skills: An Introduction to React Native for Mobile App Development,"<p>Do you already know JavaScript and want to create cross-platform native iOS and Android apps? Learning React Native, one of the most popular web framworks to develop native iOS and Android apps, will teach you an exciting new way to develop mobile applications using the power of the JavaScript library React.  This workshop will walk you through a brief introduction of the framework and help you build your first React Native through the hands-on demonstrations during the workshop. Attendees will also receive classroom-ready assignments using React Native.  Utilizing your existing JavaScript knowledge this workshop will teach you how to create cross-platform iOS and Android apps with React Native. Equipment Required. Participants must bring a laptop to equipment.</p>","<p>This workshop will show how web development skills can be used to develop native mobile apps (iOS, Android, and Web) via React Native, an open-source framework developed by Facebook. React Native extends the popular React web framework with support for truly native mobile apps. After completing the workshop participants will have a classroom-ready assignment to share with their students.
In Part I we will explore the basic concepts of React, which participants will use to build a website. In Part II we will discuss the ""native"" features added by React Native and extend the example into a mobile device friendly version incorporating mobile-specific concepts, such as Touch Events. In Part III we will introduce more advanced React Native topics, including debugging techniques and deployment to actual iOS/Android devices.
This workshop requires a laptop. Deployment of code to an actual device is optional but requires either an Android or iOS Device. Prior to the workshop participants will be given instructions for both software installation (required) and mobile device configuration (optional).</p>",B113
307,129,3/13/2020,Ahmed Ibrahim,Building and hacking an exploitable WiFi environment for your classroom,"<p>In this workshop, you will learn (1) how to build an exploitable WiFi environment for your classroom, (2) how Raspberry Pis can be used to act as the necessary clients for your access points, and (3) how to hack such access points. You will also have access to all of the Raspberry Pi scripts and access point configuration directions.  Then, you will get a chance to hack up to four WEP access points as well as a WPA2 access point.  Note: Participants must have a laptop with VirtualBox installed and an available USB port.  Before the workshop, you will be provided a link to download and import a tested Kali VM to participate in the hands-on hacking activity.</p><p>Equipment Required.  Participants must bring a laptop or equipment.</p>","<p>With the widespread of WiFi nowadays, it is important to show students how WiFi access points can be exploited in practice. The theory behind exploiting WEP and WPA2 has been available for a number of years. However, it has not been easy to offer students the opportunity to apply these theories in a real environment. In this workshop, you will learn how to build and configure WiFi access points for your students to hack. You will learn how Raspberry Pis can be used to act as the necessary clients for those access points and you will have access to the Raspberry Pi scripts and all access point configuration directions. Then, we will discuss the different hacking scenarios where WEP access points have connected clients versus no connected clients. In addition, you will get a chance to hack up to four WEP access points in addition to a WPA2 access point. Note: Participants must have a laptop with VirtualBox (version 5.1.28 recommended) installed and an available USB port.</p>",B115
308,820,3/13/2020,Manuel P&eacute;  rez Qui&ntilde;  ones,How to become fluent in diversity in one evening,"<p>This workshop is intended for CS educators, researchers and graduate students who want to be more comfortable talking about diversity. Are you overwhelmed with the language used in diversity conversations? Come learn about under-representation, minorities, under-served, privilege, stereotype threat, micro-aggression, fragility, anti-racism, equality, equity, inclusion, gender fluid, sexual identity vs. expression vs. gender, Latino vs. Hispanic, person of color...</p>","<p>The computing discipline is struggling to diversify its ranks. While we recognize the value of a diverse workforce, we often lack the language to discuss and even justify it. This workshop presents the language and framework with which to talk about diversity. The participants will get to have a candid conversation about different themes in diversity, often from a multi- disciplinary perspective and examine popular misconceptions on the topic. Of particular interest to computing professionals will be the presentation of research relevant to our discipline supporting the case of diversity.</p>",D133
309,856,3/13/2020,David Malan; Chad Sharp; Jelle van Assema; Brian Yu,CS50's GitHub-Based Tools for Teaching and Learning,"<p>A hands-on introduction to CS50's free and open-source tools for teaching and learning that you can adopt or adapt for your own classroom, including: help50, which helps students understand error messages; check50, via which teachers (and students) can test the correctness of code; style50, which provides students with feedback on their code's style; submit50, via which students can submit work; and compare50, an open-source and extensible alternative to Moss for comparing submissions for plagiarism. This workshop is free thanks to support from GitHub. To attend, register as usual, and GitHub will reimburse you via PayPal or (if you provide an I9 form) check.</p>","<p>For CS50 at Harvard, we have developed a suite of free, open-source tools to help students with writing, testing, and submitting programming assignments; and to help teachers grade those assignments and check them for plagiarism. help50, a program that parses error messages and provides beginner-friendly advice to interpreting them, helps students understand and resolve often-cryptic compiler errors. check50 runs a set of automated tests on students' code, providing feedback and hints about where students have made errors. style50 lints students' code, highlighting places where it doesn't meet the course's style guide. submit50 allows students to submit assignments to a GitHub repository, without students needing to have knowledge of git or version control themselves. And compare50, an open-source and customizable alternative to Moss, allows teachers to analyze submissions for similarity, looking for pairs or clusters of submissions that might be the result of improper collaboration. The grading and submission tools require only a GitHub account to use, and can serve as free, extensible alternatives to tools like Codio, Gradescope, and Vocareum. In this workshop, we'll introduce each of the tools, and discuss how to use them for your own classroom. To date, each tool has been deployed to hundreds of students on campus and thousands online. Along the way, we'll discuss how to use the tools effectively, compare and contrast them with other options, identify how the tools have changed students' behavior for the better and for worse, and highlight pedagogical and technological changes we've made to redress the latter.</p>",D136
310,857,3/13/2020,Dan Garcia; Buffie Holley; Julia Bernd; Maritza Johnson,Teaching Cybersecurity in CSP (or Any CS Class): Introducing the Security Mindset,"<p>This interactive workshop will introduce the broad idea of cybersecurity through threat modeling and the human-centered nature of authentication. Participants will learn how to begin developing the ""security mindset"" in CS students at all levels. No previous cybersecurity experience is required! 
The Teaching Security lessons at teachingsecurity.org were designed to meet the cybersecurity learning objectives in the AP Computer Science Principles framework, but they are appropriate for any high school computer science class or program (including dedicated cybersecurity classes). Our lessons are prepared by subject-matter experts, and include many ""unplugged"" activities. In addition to model lessons, the workshop will provide opportunities for attendees who teach cybersecurity to share their own strategies. 
Cybersecurity is vital to a technology-driven society. Daily headlines about data breaches and ransomware attacks demonstrate that we can't ignore the security risks inherent to our highly networked lives. Cybersecurity is a growing job field -- and even for students that don't go on to pursue cybersecurity careers, it is crucial to have some level of security awareness! 
But until very recently, young people usually weren't introduced to the intrigue and opportunity of cybersecurity until advanced undergraduate CS courses. However, the real world implications and applied nature of the topic lends itself well to catching the interest of a diverse group of students in CS at a younger age.</p><p>See <a href=""https://teachingsecurity.org/sigcse-2020/"">https://teachingsecurity.org/sigcse-2020/</a> for more info.</p>
<p>Equipment Optional. It is not necessary for participants to bring equipment.</p>","<p>Cybersecurity is vital to a technology-driven society. Daily headlines demonstrate that we cannot ignore the potential security risks inherent to our increasingly more networked lives. Cybersecurity is a growing job field --but even for students that don't go on to pursue cybersecurity careers, it is crucial to have some level of security awareness! But until very recently, young people were usually not introduced to the intrigue and opportunity of cybersecurity until advanced undergraduate CS courses. However, the real world implications and applied nature of the topic lends itself well to engaging a wide audience, key to catching the interest of a diverse group of students in CS at a younger age.</p>
<p>We have developed a series of lessons that introduce the broad idea of cybersecurity through threat modeling and the human-centered nature of authentication. They were prepared by subject-matter experts with research backgrounds in the technical workings and social implications of cybersecurity. While our lessons were specifically designed to meet the cybersecurity learning objectives in the AP Computer Science Principles framework, they are appropriate for any high school computer science class.</p>
<p>This will be an interactive workshop for CS educators at all levels; no previous cybersecurity experience required. (Laptops also optional.) Participants will learn how to begin developing the ""security mindset"" by teaching students a simplified version of threat modeling. We will also preview lessons on authentication and social engineering. In addition, the workshop will provide opportunities for attendees who teach cybersecurity learning objectives to share their own strategies.</p>",E145
311,775,3/14/2020,Alexandra Gendreau Chakarov; Quentin Biddy; Derek Runberg,Using sensor technologies to introduce middle school students to computational thinking and computer science,"<p>Bring computational thinking and middle school science to life with micro:bit, sensor technologies including temperature, sound, humidity, carbon dioxide, and soil moisture, and block based programming. Learn how to use these tools to make the invisible visible by collecting and visualizing data in real time through simple investigations such as measuring air quality and noise levels. No prior programming experience necessary. 
Participants will gain hands on experience working with the micro:bit, gator:bit, and alligator clippable sensors through the creation of a data visualizations using real time data collected using the sensors.
In addition to creating and programming their own real time data visualizations, participants will be given access to a tested curriculum, making it easy to implement these ideas in the classroom immediately.
The materials are targeted at middle school students, but could work with students in grades 4-10. </p>
<p>Equipment Required. Participants must bring a laptop or equipment.</p>","<p>This workshop will explore using school-based sensor technologies to bring computational thinking into middle school science and integrated STEM courses. Participants will learn how to introduce students to sensor technologies and support their understanding of how to use sensor technologies to ""make the invisible, visible."" We will use the sensor technologies to conduct a variety of short, real-world investigations, such as measuring air quality and noise levels using the available sensors. Teachers will largely play the role of students as they learn to program the sensor technologies, gather and analyze data, and create displays to share their findings. The workshop will use an open-access, one-week sensor immersion curriculum, and ideas for improvements will be solicited from by the group. No prior experience using sensor technologies or programming is needed.</p>",C125
0,,3/14/2020,3:30 PM - 6:30 PM,Saturday Workshops,,,
401,836,3/14/2020,Barbara Ericson; Bradley Miller,Using and Customizing Open-Source Runestone Free Ebooks for Computer Science Classes,"<p>Come learn about many free interactive ebooks on the open-source Runestone Interactive platform that can be used in high school (AP CSP and AP CSA) or college computing courses (CS1, CS2, data science, and web programming). These ebooks include executable code and a wide variety of practice problems. You can create a custom course from any of the existing ebooks and then track your student's progress. You can create and grade assignments. You can require spaced practice. Students enjoy using the ebooks. They appreciate the immediate feedback and the variety of practice problems.</p>","<p>Runestone Interactive is an open-source ebook platform designed to create and publish free interactive computer science textbooks. (See http://runestoneinteractive.org). Runestone ebooks support programming within the browser, code visualization/stepping, and a wide variety of practice activities, including multiple choice, fill-in-the-blank, clickable-code, and mixed-up code (Parsons problems). Free textbooks have been created for CS1, CS2, web development, data science, and AP CS (both courses). The presenters have several years of experience creating and using Runestone ebooks. Several studies have demonstrated good usability and positive learning and attitude impacts on students using these ebooks. Runestone ebooks can be customized to meet the needs of individual courses and teachers. Over 25,000 people a day use Runestone ebooks.</p>
<p>The goal of this workshop is to introduce computer science teachers (both secondary and post- secondary) to Runestone ebooks. The hands-on session will start by leading participants through use of the ebooks as if they were students. Participants will be introduced to the interactive features of the ebooks. Participants will next create a custom course from an existing ebook in the library and will use the instructor's dashboard to review student activity, modify the course, grade students, and set up a practice tool. Participants will create their own assignments using existing active learning components. Participants will also be shown how to create new material for assignments, such as multiple-choice questions for a quiz.</p>",C120
402,823,3/14/2020,Stan Kurkovsky; Stephanie Ludi,Active Learning with LEGO for Teaching Software Development,"<p>This workshop is intended for faculty teaching undergraduate and graduate courses focusing on software development, software engineering, and related concepts. This workshop will also benefit other educators looking for ways to supplement their courses with engaging and playful hands-on activities aimed to strengthen the teamwork, oral communication, problem solving, and design skills of students. 
Participants will participate in several LEGO activities that focus on iterative software processes, interfaces and integration, and distributed software engineering.
Participants will learn how LEGO can be used as an active learning tool to facilitate teaching software engineering.
Many relevant resources are located at <a href=""https://web.ccsu.edu/lego-se/"">https://web.ccsu.edu/lego-se/</a>.</p>
<p>Equipment Not Required. Participants do not need any equipment.</p>","<p>LEGO is a construction toy familiar to many students. Creating software, regardless of scale, is often similar to building with tangible objects, such as houses or bridges--an analogy that is often used in the classroom. In this workshop, we will show how to use LEGO as an engaging medium to introduce students to concepts of iterative development, software interfaces, team velocity, and distributed software projects. LEGO-based analogies and case studies enacted as hands-on exercises for student teams help develop a better understanding of the underlying concepts, while keeping students deeply engaged in the course material.</p>
<p>This workshop is intended for faculty teaching undergraduate and graduate courses focusing on software development, software engineering, and related concepts. This workshop will also benefit other educators looking for ways to supplement their courses with engaging and playful hands-on activities aimed to strengthen the teamwork, oral communication, problem solving, and design skills of students.</p>
<p>We will practice several hands-on LEGO-based activities during the workshop. Specific topics of these activities will include change management and object-oriented interfaces, as well as activities specific to the phases of software development. Workshop participants will learn about other LEGO-based activities that focus on a broad range of topics including requirements engineering, architectural design, and software dependability. A laptop is not required for this workshop. This work is supported in part by the National Science Foundation Awards 1611905, 1709244 and a 2015 ACM SIGCSE Special Project grant. For more information visit <a href=""http://www.cs.ccsu.edu/~stan/sigcse2020/"">http://www.cs.ccsu.edu/~stan/sigcse2020/</a>.</p>",C122
