number,easychair,date,authors,title,advertisement,abstract,location
403,752,3/14/2020,Celine Latulipe; Tonya Frevert; Sarah Provencal,Challenging Social Exclusion in Computing via 'Theatre of the Oppressed' Pedagogy,"<p>Come and rehearse social change! In this workshop, you will have the opportunity to experience a participatory 'Exclusion Response Workshop' based on Augusto Boal's Theatre of the Oppressed methodology. This workshop is designed to help post-secondary CS students openly talk about difficult issues around diversity and inclusion in a way that is engaging and fun. You don't need any prior knowledge or theatre experience and you don't need to bring anything except yourself dressed in comfortable clothes (lots of movement). Faculty, administrators, and students are all welcome.</p>","<p>Micro-aggressions, hostile climates, and intersectional discrimination contribute to students feeling excluded from fully participating in Computer Science or other STEM programs. To address this exclusion, students need to empathize with each other, and for that we need them to be having frank, open conversations about difficult situations. This is hard to achieve, as people do not typically want to talk about difficult situations with strangers. Computer Science faculty may shy away from these difficult conversations, as they may feel they lack the expertise to address social issues effectively. </p>
<p>To address this issue, we have been conducting 'Exclusion Response Workshops' based on the 'Theatre of the Oppressed' methodology of rehearsing social change. This involves students anonymously contributing scenarios of micro-aggressions they have experienced or witnessed and then roleplaying alternate outcomes. These workshops create an empathetic environment for frank and open discussion of difficult issues. We have been scaling this effort by conducting workshops with all freshmen and transfer students in our College of Computing and Informatics. In this SIGCSE workshop, attendees will participate in an Exclusion Response Workshop, then have an open discussion about the workshop experience, workshop logistics, and pros and cons of running this workshop as a mandatory class activity versus a voluntary activity. Participants will learn about the workshop structure, and the Theatre of the Oppressed methodology. This workshop is a taste of a 3-day, train-the-trainer workshop that we will be conducting at our institution in May 2020. This work is supported by NSF IUSE/RED Award #151960.</p>",C125
404,181,3/14/2020,Denise M. Case; Colton Steeve; Matthew Woolery,"Progressive Web Apps are a Game-Changer! Use active learning to engage students and convert any website into a mobile-installable, offline-capable, interactive app","<p>Come learn about progressive web apps and how powerful technologies are changing the game in application design and development! In this workshop, you'll learn computer science teaching techniques to engage students using some of the most modern and in-demand skills, languages, and techniques! Learn how to take an existing web site and upgrade it into an app that users can keep close at hand and access even while offline. Learn the power of service workers and smart caching, while teaching event-driven, functional, and asynchronous development in one of the most popular languages. You must have a laptop (not a tablet) and be able to download and create and edit files on your laptop.</p>","<p>Learn how to design and create powerful new progressive web apps (PWA)! We'll introduce the computer science principles that enable modern web sites to be converted into installable apps. We'll start with an engaging web site (built with HTML/CSS/JavaScript) and show in just two easy steps, how to create an engaging app that can be installed on mobile devices, including Android phones, iPhones, iPads, tablets, and more. We'll illustrate the principles by converting an open source, cloud-hosted client-side app. We'll talk about manifest files and JSON, then introduce the powerful new service workers and JavaScript. We'll use Google's free Workbox libraries and show how PWA enable up web apps to interact with device APIs and alter requests before and after sending. You can easily install (and uninstall) the apps - and even use an app while your device is offline. We'll show how engaging tools like Lighthouse provide critical feedback on performance, accessibility, best practices, and more. As a bonus, we'll provide a PWA syllabus that you can customize to your courses. Skills for developing these apps are in demand, and quite accessible to students.</p>",B110
405,63,3/14/2020,David Largent; Christian Roberson,Transform Your Computer Science Course with Specifications Grading,"<p>Are you tired of spending time dealing with students who complain over fractions of points? What if there was a better way to do grading that actually measured student learning outcomes, caused less arguments, and took less time? Well, there is, and it's called specifications grading.</p>
<p>This workshop will explain what specifications grading is and give you an opportunity to apply these techniques to the actual computer science courses you teach. Although the presenters come from higher education, the concepts presented in this workshop are applicable for you, whether you are a middle school, high school, or university teacher.
Please bring one or more of your current syllabi and/or assignment instructions with you to this interactive workshop. You will leave the workshop with a plan to modify at least one of your courses. </p>
<p>You will also receive access to a set of handouts and sample materials created by the presenters. </p>
<p>Equipment Recommended. It is recommended, but not required, that participants bring a equipment.</p>","<p>As proposed by Linda B. Nilson in ""Specifications Grading: Restoring Rigor, Motivating Students, and Saving Faculty Time"", specifications grading is an assessment construct that relies on pass/fail grading of assignments and assessments, the structuring of course content into modules linked to learning outcomes, and the bundling of assignments and assessments within those modules. One of the intentions of this type of course grading construct is to more closely align assessment with student attainment of intended learning outcomes. While there has been very visible work in incorporating specifications grading in some academic areas (e.g. in mathematics), examples of the use of specifications grading in computer science courses are less common. The goal of this workshop is to introduce the concepts of specifications grading, explain how to apply these concepts to a wide range of computing courses, and have the participants apply these concepts to one of their current or upcoming computer science courses. Each participant should leave the workshop with at least one revised course syllabus or assignment that incorporates specifications grading.</p>",B112
407,814,3/14/2020,Valerie Tomici,Teach Girls To Code and Change the World,"<p>Educators are invited to join the movement to close the gender gap in tech by bringing free STEM curriculum and activities to girls. During this presentation, we will feature Girls Who Code Clubs, which are completely free after-school programs for 3rd-5th or 6th-12th grade girls.
Together, we will discuss how to start a free Girls Who Code Club, participate in hands-on activities that you can walk away with, and engage in a design thinking activity to help you bring code and gender equity to your community. 
Participants will leave the workshop feeling inspired to change the image of what a computer scientist looks like and feel prepared to bring exciting STEM resources back to their communities. 
Girls Who Code has served over 185,000 students across the U.S. and Canada since launching in 2012. Our alumni major in Computer Science and related fields at a rate 15 times higher than the national average. </p>
<p>Equipment Optional. It is not necessary for participants to bring equipment.</p>","<p>At Girls Who Code, we believe that all girls are capable of making a positive impact on the world through computer science. That is why we are leading the movement to close the gender gap in technology and change the image of what a programmer looks like and does. Join us to learn more about how to encourage girls in your community to connect their new coding skills and confidence with real world problems they care about!</p>
<p>During this presentation, we will be featuring our Girls Who Code Clubs, which are completely free after-school programs for 3rd-5th or 6th-12th grade girls to join a sisterhood of supportive peers and role models and use computer science to change the world. Through fun and interactive curricula, Club girls not only learn about how to positively impact their community through code, but they also are taught to be brave and resilient -- which has an enormous impact on how they approach challenges and whether they stick with coding in the years to come.</p>
<p>Together, we will discuss how to start a Girls Who Code Club, participate in hands-on activities that you can walk away with, and engage in a design thinking activity to help you bring code and gender equity to your community. We hope you will join us in our movement to close the gender gap in technology!</p>",B115
408,806,3/14/2020,Anthony Suen; Eric Van Dusen; Cathryn Carson; David Culler,Innovation in Undergraduate Data Science Education,"<p>Participants will learn about innovative ways of teaching Data Science, in a broad set of domain applications, using open source tools. 
Highlights will include engaging a diverse set of students, integrating ethical content into the curriculum, and adopting across a diverse set of institutions. 
A participant will learn about a vision for an inclusive data science curriculum, that is growing rapidly in scope and geography. 
This workshop, presented by staff and faculty from UC Berkeley's data science program, will guide participants through a menu of tested innovations that can enable the teaching of undergraduate data science to thousands of students from all backgrounds. It gives participants insight into and experience with the pioneering ""Foundations of Data Science"" (data8.org) course, which teaches computational and statistical concepts by leveraging real world data and is open to students from any major with no math or programming prerequisites, as well as other elements of Berkeley's curriculum that engage students across the disciplines. Specific topics that the workshop will cover include 1) Pedagogical decisions and assumptions in the Data 8 class, 2) Illustrations of domain specific applications of data science teaching approaches (connector courses, shorter modules) in non-CS classes across disciplines, 3) Integration of human contexts and ethics into the curriculum, 4) Teaching using a cloud-based server (Jupyterhub) and deploying open source cloud based cyber-infrastructure, 5) involvement of undergraduate students in curriculum development, teaching, and program development, and 6) Case studies from other colleges and universities and an emerging community of practice. Goals include engaging students in learning through real-world examples, increasing diversity among students learning computer science, giving students a strong ethical foundation within their computer science work, and encouraging critical thinking in the application of inference and statistical techniques. </p>
<p>Equipment Recommended. It is recommended, but not required, that participants bring equipment.</p>","<p>The workshop will allow participants to gain experience with a series of innovations developed at UC Berkeley that have enabled the teaching of undergraduate data science at scale to students from all backgrounds. Rather than beginning with established introductory strategies as the gateway to computer science, students in the ""Foundations of Data Science"" (Data 8) learn computational skills and concepts in relation to real world issues and with attention to societal implications. By engaging with students' interest in the applications of computing on data, and integrating societal impact from the start, the program has developed long term commitment to advance computational skills for large numbers of students. These innovations in teaching not only convey important computational content, but also broaden participation beyond existing approaches to computer science, and integrate issues of human contexts and ethics throughout the full curriculum. Goals include increasing diversity among students learning computer science, giving students a strong ethical foundations within their computer science work, and encouraging critical thinking in the application of inference and statistical techniques.</p>",D133
409,811,3/14/2020,Ryan Torbey; Carol Fletcher; Joshua Childs; Monica McGill,Modifying Existing Evaluation Instruments to Fit Your CS Research Needs,"<p>Have a CS education research project that needs instrumentation? This session is for you! Come learn how to find, remix, and use existing instruments by delving into the process of taking openly shared resources and repurposing them for your projects.</p>","<p>Developing your computer science education research evaluation instruments from scratch may be no longer necessary thanks to the growing catalog of instruments curated by csedresearch.org. This workshop will teach participants how to find, remix, and use existing instruments by delving into the process of taking openly shared resources and repurposing them for your projects. In addition to discussing the importance of using instruments that have been shown to have evidence of reliability and validity, the team from The University of Texas at Austin will discuss how they amended existing surveys and interview protocols to develop tools customized to their needs for their NSF-funded CSforAll Research Practitioner Partnership. Workshop participants will break into groups and be given extensive time to review and revise research instruments. Key takeaways from this workshop will be the steps you need to take to choose an instrument based on your research question and study design, the role that validity and reliability play in instrument design, how to make modifications to an instrument (if needed) to better address your research question, and how to add your instruments to the <a href=""http://csedresearch.org"">csedresearch.org</a> site.</p>",D136
410,858,3/14/2020,Michael Ball; Lauren Mock; Dan Garcia; Tiffany Barnes; Marnie Hill; Alexandra Milliken; Joshua Paley; Efrain Lopez III; Jason Bohrer,The Beauty and Joy of Computing Curriculum and Teacher Professional Development,"<p>This workshop is intended for current AP CS Principles teachers using the Beauty and Joy of Computing Curriculum. The intended goals are to learn about and reflect on the updates of the AP CSP course, as well as discussion about updates and changes to the BJC Professional Development for 2020. 
The highlights include review of the new BJC curriculum and the Teacher Guide that has been endorsed by the College Board for 2020. 
Participants will learn about how the BJC 2020 curriculum correlates with the new Big Ideas, Computational Thinking Practices and Skills, and Enduring Understandings.
This is intended for those who are currently teaching AP CSP using the BJC curriculum. </p>
<p>Equipment Recommended. It is recommended, but not required, that participants bring equipment.</p>","<p>The Beauty and Joy of Computing (BJC) is a CS Principles (CSP) course developed at UC Berkeley, intended for high school juniors through university non-majors. It was twice chosen as a CSP pilot, and both the College Board and code.org have endorsed it. Since 2011, we have offered professional development to over 600 high school teachers. Through partnerships with EDC (Education Development Center), the New York City Department of Education, and CSNYC, our NSF-funded BJC4NYC project will be bringing BJC to 100 high school teachers in New York City, the largest and one of the most diverse school districts in the country. Our guiding philosophy is to meet students where they are, but not to leave them
there. It covers the big ideas and computational thinking practices required in the AP CSP curriculum framework using an easy-to-learn blocks-based programming language called Snap! (based on Scratch), and powerful computer science ideas like recursion, higher-order functions and computability. Through the course, students learn to create beautiful images, and realize that code itself can be beautiful. Having fun is an explicit course goal. We take a ""lab-centric"" approach, and much of the learning occurs through guided programming labs that ask students to explore and play. In this workshop, we will provide an overview of BJC, share our experiences as instructors of the course at the university and high school level, provide a glimpse into a typical week of the course, and share details of potential crowd-funded summer professional development opportunities.</p>",E145
