track,title,abstract,authors,type,doi-num,doi-address,video-link,supplemental-link
Poster Session,"Poster #124: Barriers, Challenges and Strategy Use of Students with High-Incidence Disabilities","<p>Computer science (CS) education K-12 has spread at a remarkable pace over the last few years. As CS education becomes more and more a part of the general curriculum, students with disabilities, who spend much of their time in general education classrooms, will be included. Yet, there is little research on how to equitably and rigorously include students with disabilities in CS education. To begin to understand how best to provide CS educational services to diverse learners, we must first understand the challenges and barriers they face and what strategies they are already using to enable their success. This basic qualitative interpretative study utilized video screencast data of three upper-elementary students with high-incidence disabilities engaged in block-based programming. Findings confirmed students encountered multiple barriers and challenges, both unique and shared, across classrooms. While students utilized several problem solving and debugging strategies, they seldom did so in a systematic fashion.</p>",Todd Alan Lash,Sub,10.1145/3328778.3372589,https://doi.org/10.1145/3328778.3372589,,
Poster Session,Poster #125: Improving User Experience for GENI-based Cybersecurity Labs,"<p>GENI (Global Environment for Network Innovations) has been used in network research and education for more than one decade. However, very few institutions utilize the virtual machines (VM) deployed on GENI for generalized computer education. One major reason is the limited user interface offered by GENI VMs. In this poster, we introduce the desktop environment to GENI VMs, thereby widening the student base in computer education. Specifically, as the demand of Cybersecurity education increases, we show that by introducing the desktop environment to the existing flexible network topology, GENI becomes more inclusive in offering cybersecurity education to a wide range of students, ranging from entry level students, who are unfamiliar with command line interface, to the advanced students, who are interested in sophisticated network attacks and preventions. The preliminary student survey result shows that most students have no problem using GUI lab environment.</p>",Yongzhi Wang; Wen-Jung Hsin,Sub,10.1145/3328778.3372585,https://doi.org/10.1145/3328778.3372585,0,https://drive.google.com/open?id=1we_JsX1ulMCh6FcPjIJLPJfl-0bvgNu4
Poster Session,Poster #126: Teaching Platform for Network Communication and Protocols Using a Micro:bit Based Wheeled Robot,"<p>In this study, we presented a lightweight inverted curriculum for teaching the essential details of network communication and protocols to undergraduate students major in computer science. Students are instructed to construct a wireless communication and control system connecting a computer to a wheeled robot using the Micro:bit platform. This platform consists of a micro-controller loaded with a Python interpreter and an additional extension board integrated with motors and sensors. In this study, we describe how the students were instructed to build the system step by step, from establishing a wired connection to implementing a TCP server on the PC-side for wireless control. Students can learn these knowledge through practice, which improves classroom engagement as a consequence.</p>",Zizhang Luo; Yuxuan Zhou; Bohan Yu; Junfeng Hu,Sub,10.1145/3328778.3372605,https://doi.org/10.1145/3328778.3372605,,
Poster Session,Poster #127: Preparing Pre-Service Teacher Candidates for the Praxis Exam: An Innovative Model of Blended Support,"<p>The expansion of K-12 computer science (CS) has driven a dramatic need for educators who are trained in CS content and pedagogy [1]. This poster describes our effort to train teacher candidates (i.e., pre-service teachers who are students seeking degrees within a College of Education), who are specializing in secondary mathematics education, to be future CS educators. We specifically describe our collaboration to provide a blended preparatory six-week training for the ETS CS Praxis exam (5652), assisting our pre-service students in satisfying the CS certification requirements in our state before they graduate and begin their professional teaching career. Given the unique challenges of pre-service CS teacher preparation [2], blended models, which combine both in-person and online instruction, are an effective approach to building a pre-service program.</p>
<p>Within our pre-service CS program, students first complete a two-course pathway that prepares them in AP CSP content and pedagogy experiences, including observations in local AP CSP classrooms [3]. After completing the two courses, our students participate in the blended version of the WeTeach_CS Praxis preparation course to achieve certification. The in-person support provided by the blended model contributed significantly to certification success in this project. With a cut-score of 149 for the Praxis exam, all 11 of our pre-service students who completed the course received a passing score (including one student with a perfect score of 200, and another student with a 195); the average score for our pre-service students was 175. An additional 11 in-service teachers, with diverse backgrounds in CS content knowledge, also participated in the blended Praxis preparation course, with an average score of 166.</p>
<p>Given the unique challenges of pre-service CS teacher preparation, university pre-service CS teacher programs should look to innovative models of teacher support developed by in-service programs to make substantial gains in CS teacher certification. Incorporating an asynchronous online course that allows teachers with a wide range of prior experience in CS to learn at their own pace with in-person coursework and support appears to be a viable model for assisting non-CS major teacher candidates in achieving a CS certification. With the blended model, even teachers with no background knowledge in CS were successful.</p>
<p>Within our pre-service CS program, students first complete a two-course pathway that prepares them in AP CSP content and pedagogy experiences, including observations in local AP CSP classrooms [3]. After completing the two courses, our students participate in the blended version of the WeTeach_CS Praxis preparation course to achieve certification. The in-person support provided by the blended model contributed significantly to certification success in this project. With a cut-score of 149 for the Praxis exam, all 11 of our pre-service students who completed the course received a passing score (including one student with a perfect score of 200, and another student with a 195); the average score for our pre-service students was 175. An additional 11 in-service teachers, with diverse backgrounds in CS content knowledge, also participated in the blended Praxis preparation course, with an average score of 166.</p>
<p>Incorporating an asynchronous online course that allows teachers with a wide range of prior experience in CS to learn at their own pace with in-person coursework and support appears to be a viable model for assisting non-CS major teacher candidates in achieving a CS certification. With the blended model, even teachers with no background knowledge in CS were successful.</p>",Rebecca Odom-Bartel; Carol Fletcher; John Owen; Jeff Gray; Jeremy Zelkowski,Sub,10.1145/3328778.3372654,https://doi.org/10.1145/3328778.3372654,0,https://drive.google.com/open?id=1v7MvU8VCnL_vDYf6CBj9mDwqRJ1ipxg_
Poster Session,Poster #128: Video Analysis of Student Challenges and Interactions in Computational Thinking-integrated Botany,"<p>This study aimed to understand elementary students' challenges and interactions in computational thinking-integrated botany through robotics activities. Data was collected from screen-casting videos and analyzed using Collaborative Computing Observation Instrument (CCOI), a web-based analysis instrument with nodes and paths that classify and specify students' computing experience. The results revealed that all participants engaged in independent work for most of the time, with short interactions on 1) general computer technology issues; 2) software navigating issues; 3) questions about academic content; 4) computing discussion with the instructor; 5) informing the instructor about task accomplishment. The findings of this study will provide important insights to CS researchers, educators, and elementary teachers regarding CT-integration research and practice.</p>",Ruohan Liu; Feiya Luo; Maya Israel,Sub,10.1145/3328778.3372631,https://doi.org/10.1145/3328778.3372631,,
Poster Session,Poster #129: University-wide Adoption of Data Science,"<p>Data Science is an essential concept for twenty-first century workforce and as a result the need to help all students acquire such skill has recently gained increased attention. However, most smaller schools are currently facing challenges to provide related knowledge and skill to a broad student population. During Spring of 2019, we organized a faculty workshop on ""Data Science Pedagogy and Practice"" aimed at building and enhancing data science capacity (teaching, research, partnership, collaboration) at our institution. We gathered faculty input on what would be needed for a successful university-wide initiative to incorporate data analytics concepts as a basic component of training across variety of disciplines including science, business and social sciences. We were able to identify certain challenges and opportunities to accommodate deeper coverage of data science in the undergraduate teaching and research, and as a result, we initiated few efforts such as 1) teaching through faculty partnership, 2) module-based integration into existing courses rather than developing new courses, 3) development of reusable course modules and augment that with contextual hand-on projects so that students could appreciate the use of data science in their own career path, 4) facilitation of course preparation and implementation via a small faculty adopter grant, and 5) development of a graduate certificate program in data analytics. In this poster, we report our experience in organizing and implementing the workshop, the key aspects of the university-wide data science efforts initiated as a result of the workshop, and the lessons learned so far from these initiatives.</p>",Debzani Deb; Elva Jones; Austin Hodge,Sub,10.1145/3328778.3372657,https://doi.org/10.1145/3328778.3372657,,
Poster Session,Poster Session 2,,Monisha Pulimood; Ruth Anderson,Session,,,,
Poster Session,Poster #201: Engaging Women in Coding: An Interdisciplinary Approach,"<p>The focus of this effort is to provide teaching practices to engage women college students in learning Python computer programming by solving interdisciplinary problems. Interactive and collaborative tools are adapted and presented such as pair programming, think/pair/share, code tracing, debugging faulty code, and pedagogical code reviews. The goal is to offer a classroom experience that combines several methods to provide an engaging, fun and inclusive environment to women. The results show students' success in learning fundamentals of computer programming in Python, but more importantly, these classroom practices proved to be inspiring and motivating. Women participants gained confidence and a sense of belonging in a CS classroom.</p>",Almudena Konrad,Sub,10.1145/3328778.3372625,https://doi.org/10.1145/3328778.3372625,,
Poster Session,Poster #202: Transitioning to Teaching Android With Kotlin and Jetpack Components,"<p>Android tends to be the platform of choice in the education community due to its openness and the use of Java. Any major changes to the way Android apps are built could be helpful to both teachers and students. As of last year, Android officially supports Kotlin -- a modern Java interoperable language that offers null safety, reduced verbosity and numerous other modern programming language features. Furthermore, the current Android developer tool-set has been expanded to include a set of new libraries, tools, and architectural guidances called Android Jetpack. The new components simplify the process of implementing complex mobile app tasks such as lifecycle handling, persistence and background operations. In this poster, we share our findings in updating and teaching a CS3 introductory mobile software development course that was originally taught in Java.</p>",Andrey Esakia,Sub,10.1145/3328778.3372603,https://doi.org/10.1145/3328778.3372603,,
Poster Session,Poster #203: Broadening Participation in Computing through Transforming Media and Technologies,"<p>Broadening participation in computing ensures that a diversity of perspectives are involved in creating new technologies. Yet despite initiatives aimed at bringing more diverse groups into computer science as a discipline, underrepresented groups are still under threat to be crowded out of formal computing spaces. However, there are informal spaces where these populations engage in computational projects, learning computing skills outside of traditional academic or industry computing spaces. One such space is transformative fandom. We propose exploring how people in transformative fandom innovate and transform technologies, with an emphasis on their involvement in computational projects by and for marginalized communities.</p>",Brianna Dym; Casey Fiesler,Sub,10.1145/3328778.3372615,https://doi.org/10.1145/3328778.3372615,,
Poster Session,Poster #204: A Sequenced Curriculum for Teaching Introductory C++ Programming,"<p>Several computer science education studies show that it is important when teaching introductory computer programming to teach the fundamental skills needed to learn programming in a sequenced order. These skills are reading code, writing code, interpreting programming templates, and applying programming templates to specific problems. However, most introductory programming courses, and programming textbooks, often interleave these skills so that writing code may be introduced before reading code and using templates to solve problems may be introduced before students are adequately taught how to interpret those templates. This poster will present a curriculum for teaching introductory C++ programming to Computer Science majors that follows the proper sequencing of skills. Examples of reading code using variable tracing problems are demonstrated, along with example problems in writing code. These examples will highlight several programming constructs including if statements, loops, and functions. Several programming templates are shown, as well as sample problems that require the student to recognize that the problem has an associated template and then be able to apply that template to solving the problem. The templates demonstrated in the poster include variable swapping, input one - process one, accumulate values until done, and processing all elements of an array.</p>",Michael McMillan,Sub,10.1145/3328778.3372578,https://doi.org/10.1145/3328778.3372578,,
Poster Session,Poster #205: Using the CS2013 Exam for ABET Student Outcome Assessment,"<p>In anticipation of an ABET accreditation visit, our computer science department contracted with an independent external testing organization to perform an assessment of our students' proficiency in computer science. We used this external assessment to supplement our own internal assessment. The exam was easy to administer and covered multiple student outcomes. In addition, our analysis of the exam results showed high correlation between course performance and exam performance.</p>",Christopher Nitta; Kurt Eiselt,Sub,10.1145/3328778.3372614,https://doi.org/10.1145/3328778.3372614,,
Poster Session,Poster #206: A Game-Changing Instructor Tool to Reinforce Coding Concepts,"<p>We developed a 3D serious game that teaches and reinforces programming concepts. An innovative feature allows instructors to create customized challenges that students solve in the context of the game, allowing instructors to use the game to effectively target course topics or skills. A web-based portal gives instructors access to data about student performance in the game.</p>",Devorah Kletenik; Deborah Sturm,Sub,10.1145/3328778.3372610,https://doi.org/10.1145/3328778.3372610,0,https://drive.google.com/open?id=1TdAaJCNEwDodxbMFrU3zO2WchhRHm-Gn
Poster Session,Poster #207: <i>Cyber Secured</i>: A Serious Game for Cybersecurity Novices,"<p>We developed an educational serious game to teach basic cybersecurity concepts to novices. An evaluation of the game on introductory Computer Science and Business students suggests that playing the game resulted in both short-term learning gains in cybersecurity as well as longer-term retention of the concepts. We also saw evidence that students who played the game had increased interest in cybersecurity, and students self-reported interest in playing the game to learn more about and assess their knowledge of cybersecurity.</p>",Devorah Kletenik; Alon Butbul; Daniel Chan; Deric Kwok; Matthew LaSpina,Sub,10.1145/3328778.3372611,https://doi.org/10.1145/3328778.3372611,0,https://drive.google.com/open?id=1IU5E6xbiMQq4_G5p1AGdYvW4zSBfghHE
Poster Session,Poster #208: 10 Binary Games for Computer Science Education,"<p>In the race to teach programming to large, diverse audiences, low-level topics have received short shrift. We address this gap by presenting two (""10"") games we have designed - one a card game, the other an online game - to help students learn both binary manipulation and operations. These two games stand out from existing computer science `edutainment' through their novel presentation and unique take on topics that are relatively unexplored in games.</p>",Hannah Wright; John Aycock,Sub,10.1145/3328778.3372596,https://doi.org/10.1145/3328778.3372596,,
Poster Session,Poster #209: A CS Course for Non-Majors Based on the Arduino Platform,"<p>We present a model for enhancing an introductory computer science course for non-majors through the use of the Arduino platform. We have developed and tested curricular modules and associated hands-on laboratories for this model. The use of the highly visual and interactive Arduino system has improved students' learning experiences, enabling them to apply and relate fundamental computational thinking concepts of algorithmic reasoning, data representation, and computational efficiency to real-world problems. Assessment results show that the approach has been effective. We present the curricular modules, our experiences using them, as well as assessment results. </p>",Ingrid Russell; Carolyn Pe Rosiene; Aaron Gold,Sub,10.1145/3328778.3372595,https://doi.org/10.1145/3328778.3372595,,
Poster Session,Poster #210: Compiler Error Messages: Their Content and Accessibility in Novice Programming Environments,"<p>Improving the feedback that novices receive from programming environments is an important and often overlooked aspect of computing education research. This work in progress examines the effects of various mechanisms by which environments deliver feedback to users. By providing insights on the effects of these mechanisms, we aim to inform designers, developers and educators about more effective design and use of such environments for students.</p>",Ioannis Karvelas; Joe Dillane; Brett Becker,Sub,10.1145/3328778.3372617,https://doi.org/10.1145/3328778.3372617,,
Poster Session,Poster #211: Prototype of an Automated Feedback Tool for Intro CS Theory,"<p>Computing theory is an important part of computer science education, introducing students to computational models of increasing power to study possibilities and limitations of computation. The subject is, however, very abstract and mathematical, and students often struggle with it. Students must master various computational models, but there is often a lengthy delay from the time a model is introduced until a student gets feedback on their related assignment. During this time, the course has typically moved far ahead, and students become progressively more lost. To alleviate this problem, we developed a prototype of an automated feedback tool for CS theory, which extends the widely used JFLAP software. Our tool currently handles student submissions of deterministic and non-deterministic finite automata, regular expressions, context-free grammars, and push-down automata homework, where an instructor specifies the target language and the students receive immediate feedback on their submissions. Currently, for incorrect submissions, the feedback is in the form of a ""witness"" string, specifying a string on which the submission fails. Beyond regular languages, our tool attempts to solve undecidable problems; fortunately, the undecidability does not occur on typical homework assignments. We are collecting preliminary evaluation data from students using the prototype tool in their course. In our future work, we will analyze the data, and we aim to produce automated partial credit (along with the witness feedback) using SAT and QBF solvers.</p>",Ivona Bezáková; Edith Hemaspaandra; Aryeh Lieberman; Hannah Miller; David E. Narváez,Sub,10.1145/3328778.3372598,https://doi.org/10.1145/3328778.3372598,0,https://drive.google.com/open?id=14Ur82lVN2AR1a5sAY1xfv0ue0z3a2suB
Poster Session,Poster #212: Computational Thinking in Music: A Data-Driven General Education STEAM Course,"<p>This poster outlines the design and results of a course entitled ""Computational Thinking in Music."" The course teaches computational thinking principles as a general education objective to undergraduate students, using data-driven investigation to inform musical composition. Students compose a song to imitate an artist of their choice by analyzing data extracted from a corpus of crowd-sourced pop song transcriptions. Students learn principles of abstraction, decomposition, and algorithmic thinking; no coding experience is required. Quantitative and qualitative results indicate that students are learning and applying computational thinking principles. Since the course is designed and taught by a musician and is run in the music department, students also learn a significant amount of music theory and composition, including harmonic structures and harmonization principles, melodic organization, consonance and dissonance, aural analysis of formal structures and meter, and influence of rhythm and timbre to create desired sounds. 
 </p>",Jennifer Shafer; James Skripchuk,Sub,10.1145/3328778.3372597,https://doi.org/10.1145/3328778.3372597,,
Poster Session,Poster #213: Creation Support by Illustrating Codes Exemplified from Visual Queries,"<p>Creation is important process in learning programming for chil-dren. It is said that children can learn well by actually creatingprograms. In a programming workshop for children, an exampleprogram is illustrated to children prior to the creation activities. Itis assumed that children can create programs using the illustratedprogram. However, there are many cases in which it is difficultfor children to use the example programs, and they can not createprograms. This paper proposes a system that supports creationactivities by exemplifying programs from search by visual queries.Visual queries composed of sprites and emoji were applied in thissystem as children are familiar with visual environment.</p>",Koki Ito; Maki Ichimura; Juan Zhou; Hideyuki Takada,Sub,10.1145/3328778.3372604,https://doi.org/10.1145/3328778.3372604,0,https://drive.google.com/open?id=1A2sBl_vGytIMr2041X9QVAIXUMKF6M-h
Poster Session,Poster #214: Labeling Debugging in May's Journey Gameplay,"<p>Debugging is an integral part of programming and is difficult to master among novice programmers. We examine how middle-school learners approach debugging within a puzzle game, May's Journey, using a Playback Tool that provides a replay of student gameplay to support teacher practice and research. Teachers and researchers can use our labeling system and Playback Tool to observe students' debugging process and identify those who are struggling to learn how to debug their code. </p>",Ma. Victoria Almeda; Erica Kleinman; Chaima Jemmali; Carter Ithier; Elizabeth Rowe; Magy Seif El-Nasr,Sub,10.1145/3328778.3372624,https://doi.org/10.1145/3328778.3372624,,
